{
  "version": 2,
  "scope": "global",
  "verified_at": "2026-10-20",
  "sources": [
    {
      "id": "openai-projects",
      "name": "Projects in ChatGPT",
      "kind": "official-product-doc",
      "authority": "OpenAI",
      "url": "https://help.openai.com/en/articles/10169521-projects-in-chatgpt",
      "canonical_for": ["fitur ChatGPT Projects"],
      "freshness_class": "product-current",
      "verified_at": "2026-10-20",
      "review_interval_days": 14,
      "watch": true,
      "reachability_policy": "advisory",
      "status": "active",
      "notes": "Direview ulang 20 Oktober 2026: project-only memory dapat diubah lewat Project settings, Study Mode tidak berlaku di Projects, dan data controls tetap berbeda dari memory. GitHub Actions menerima HTTP 403 berulang sepanjang September–Oktober sementara halaman dapat direview melalui jalur web biasa; reachability probe dinilai advisory, bukan bukti perubahan fakta."
    },
    {
      "id": "openai-study-mode",
      "name": "Using study mode in ChatGPT",
      "kind": "official-product-doc",
      "authority": "OpenAI",
      "url": "https://help.openai.com/en/articles/11780217-study-mode",
      "canonical_for": ["fitur Study Mode"],
      "freshness_class": "product-current",
      "verified_at": "2026-10-20",
      "review_interval_days": 14,
      "watch": true,
      "reachability_policy": "advisory",
      "status": "active"
    },
    {
      "id": "openai-release-notes",
      "name": "ChatGPT Release Notes",
      "kind": "official-release-notes",
      "authority": "OpenAI",
      "url": "https://help.openai.com/en/articles/6825453-chatgpt-release-notes",
      "canonical_for": ["kronologi perubahan produk ChatGPT"],
      "freshness_class": "product-current",
      "verified_at": "2026-10-20",
      "review_interval_days": 7,
      "watch": true,
      "reachability_policy": "advisory",
      "status": "active",
      "notes": "Direview ulang 20 Oktober 2026, termasuk pembaruan GPT-6 dan Intelligent UI (7 Oktober) serta rilis hingga 16 Oktober. Kemampuan baru tidak otomatis dianggap tersedia di semua Project/model; current-state guidance tetap dibandingkan dengan artikel fitur khusus. Help Center dapat menolak probe otomatis."
    },
    {
      "id": "openai-data-controls",
      "name": "Data Controls FAQ",
      "kind": "official-product-doc",
      "authority": "OpenAI",
      "url": "https://help.openai.com/en/articles/7730893-data-controls-faq",
      "canonical_for": ["pengaturan data ChatGPT"],
      "freshness_class": "product-current",
      "verified_at": "2026-10-20",
      "review_interval_days": 14,
      "watch": true,
      "reachability_policy": "advisory",
      "status": "active"
    }
  ],
  "claims": [
    {
      "id": "projects-existing-memory-setting",
      "topic": "Mengubah memory pada Project yang sudah ada",
      "status": "confirmed",
      "summary": "Dokumentasi resmi OpenAI saat ini konsisten bahwa eligible existing Project dapat diubah antara Default dan Project-only memory melalui Project settings.",
      "evidence": [
        {
          "source_id": "openai-release-notes",
          "locator": "Edit memory settings for existing projects",
          "observation": "Release notes menyatakan existing Project dapat mengubah memory dari Project settings; update tersedia pada seluruh plan, dengan shared Project tetap project-only."
        },
        {
          "source_id": "openai-projects",
          "locator": "Memory in projects / How to change a project's memory setting",
          "observation": "Current Projects guidance menyatakan memory dapat dipilih saat membuat Project dan diubah kemudian melalui Project settings → Memory; FAQ current juga menyatakan existing eligible Project dapat dialihkan ke Project-only memory."
        }
      ],
      "reviewed_at": "2026-10-20",
      "review_interval_days": 7,
      "operational_policy": "Untuk setup Ramu baru, pilih Project-only memory. Untuk eligible Project yang sudah ada, ubah lewat Project settings → Memory; perubahan dapat memerlukan beberapa jam untuk berlaku.",
      "notes": "Shared Project tetap project-only dan tidak dapat dialihkan ke Default memory."
    },
    {
      "id": "study-mode-inside-projects",
      "topic": "Ketersediaan Study Mode di dalam Projects",
      "status": "confirmed",
      "summary": "Dokumentasi resmi OpenAI saat ini konsisten bahwa Study Mode tidak berlaku pada percakapan di Projects.",
      "evidence": [
        {
          "source_id": "openai-study-mode",
          "locator": "Turn on study mode / Troubleshooting Study Mode",
          "observation": "Artikel Study Mode current menyatakan opsi Study tidak tersedia di Project conversations."
        },
        {
          "source_id": "openai-projects",
          "locator": "Work faster and smarter with built-in tools",
          "observation": "Artikel Projects current menyatakan Study Mode dan scheduled Study hours tidak berlaku untuk Project conversations."
        }
      ],
      "reviewed_at": "2026-10-20",
      "review_interval_days": 7,
      "operational_policy": "Ramu tidak menjadikan Study Mode dependency. Scaffolding, retrieval practice, dan tutoring behavior tetap dijalankan melalui Project Instructions + course context.",
      "notes": "Jangan mengklaim Ramu memerlukan atau otomatis mengaktifkan Study Mode."
    },
    {
      "id": "projects-personal-data-controls",
      "topic": "Data Controls untuk Project pada akun personal",
      "status": "confirmed",
      "summary": "Pada akun personal, penggunaan data Project untuk peningkatan model mengikuti pengaturan Improve the model for everyone; Ramu tidak membutuhkan pengaturan ini untuk berfungsi.",
      "evidence": [
        {
          "source_id": "openai-projects",
          "locator": "FAQ — Does using projects change how my data is handled?",
          "observation": "Projects current menyatakan data Free/Plus/Pro dapat digunakan bila Improve the model for everyone aktif."
        },
        {
          "source_id": "openai-data-controls",
          "locator": "How do I stop my chats from training ChatGPT?",
          "observation": "Data Controls current menjelaskan toggle Improve the model for everyone dan bahwa chat tetap ada di history saat toggle dimatikan."
        }
      ],
      "reviewed_at": "2026-10-20",
      "review_interval_days": 14,
      "operational_policy": "Data Controls tetap pilihan akun pengguna, bukan syarat Ramu. Site Ramu tidak menerima upload file kuliah pribadi."
    }
  ]
}
